{
  "projection_schema": "ETFCTA-PUBLIC-EXPORT-001-v0.1.0",
  "release": "0.4.0",
  "generated_from": "../registry.json",
  "fund": {
    "record_id": "ETFCTA-FUND-US-DBMF",
    "ticker": "DBMF",
    "legal_name": "iMGP DBi Managed Futures Strategy ETF",
    "issuer": "Litman Gregory Funds Trust",
    "inception_date": "2019-05-07",
    "jurisdiction": "US",
    "exchange": "NYSE Arca",
    "identifiers": {
      "cusip": "53700T827",
      "isin": "US53700T8273",
      "sec_series": "S000072813",
      "sec_class": "C000229357"
    },
    "identity_source_ids": [
      "SRC-DBMF-FUND-PAGE-20260718",
      "SRC-DBMF-SEC-485BPOS-202606"
    ],
    "classification_standard": "ECS-001",
    "classification_version": "0.1.0",
    "last_reviewed": "2026-07-18",
    "next_review_due": "2027-07-18",
    "freshness_state": "within_review_window",
    "dimensions": {
      "replication_method": {
        "value": "managed_futures_replication",
        "decision_id": "DEC-DBMF-RM-001",
        "knowledge_state": "derived_ecs"
      },
      "management_mode": {
        "value": "active_management",
        "decision_id": "DEC-DBMF-AM-001",
        "knowledge_state": "derived_ecs"
      },
      "market_breadth": {
        "value": "multi_asset",
        "decision_id": "DEC-DBMF-MB-001",
        "knowledge_state": "derived_ecs"
      },
      "implementation_route": {
        "value": "mixed_derivatives_with_commodity_subsidiary",
        "decision_id": "DEC-DBMF-IR-001",
        "knowledge_state": "derived_ecs"
      },
      "benchmark_relationship": {
        "value": "not_determinable_as_index_tracking",
        "decision_id": "DEC-DBMF-BR-001",
        "knowledge_state": "not_disclosed"
      },
      "directional_flexibility": {
        "value": "long_short",
        "decision_id": "DEC-DBMF-DF-001",
        "knowledge_state": "derived_ecs"
      }
    }
  },
  "sources": [
    {
      "source_id": "SRC-DBMF-PROSPECTUS-20250429",
      "source_type": "primary_fund_document",
      "title": "iMGP DBi Managed Futures Strategy ETF Prospectus",
      "issuer": "Litman Gregory Funds Trust",
      "authority": "iMGP Funds",
      "effective_date": "2025-04-29",
      "retrieved_at": "2026-07-18",
      "document_sha256": "50fa73a96820964b5975efe064d57cb245b23eeb8c2655e18eb2be3617e6325c",
      "verification_status": "verified",
      "locator": {
        "url": "https://imgpfunds.com/wp-content/uploads/pdfs/forms-and-documents/DBMF-Prospectus.pdf",
        "section": "Principal Investment Strategies"
      },
      "preservation": {
        "status": "preserved",
        "document_sha256": "50fa73a96820964b5975efe064d57cb245b23eeb8c2655e18eb2be3617e6325c",
        "access": "restricted",
        "retrievability": "internal_restricted_archive",
        "public_locator": null
      }
    },
    {
      "source_id": "SRC-DBMF-SAI-20250429",
      "source_type": "primary_fund_document",
      "title": "iMGP Funds Statement of Additional Information",
      "issuer": "Litman Gregory Funds Trust",
      "authority": "iMGP Funds",
      "effective_date": "2025-04-29",
      "retrieved_at": "2026-07-18",
      "document_sha256": "ec4edf7966591a272ad37c944793331ebc120d95ab3097a320ded0456919848c",
      "verification_status": "verified",
      "locator": {
        "url": "https://imgpfunds.com/wp-content/uploads/pdfs/forms-and-documents/DBMF-SAI.pdf",
        "section": "DBMF subsidiary and derivatives disclosures"
      },
      "preservation": {
        "status": "preserved",
        "document_sha256": "ec4edf7966591a272ad37c944793331ebc120d95ab3097a320ded0456919848c",
        "access": "restricted",
        "retrievability": "internal_restricted_archive",
        "public_locator": null
      }
    },
    {
      "source_id": "SRC-DBMF-FUND-PAGE-20260718",
      "source_type": "issuer_fund_page",
      "title": "DBMF official fund page",
      "issuer": "Litman Gregory Funds Trust",
      "authority": "iM Global Partner",
      "retrieved_at": "2026-07-18",
      "document_sha256": "ea289386d91ecfe3caaea81a4c27e2a3728c31e90dfbd909effa4f53bd22b238",
      "verification_status": "verified",
      "locator": {
        "url": "https://www.imgp.com/dbmf-etf/"
      },
      "preservation": {
        "status": "preserved",
        "document_sha256": "ea289386d91ecfe3caaea81a4c27e2a3728c31e90dfbd909effa4f53bd22b238",
        "access": "restricted",
        "retrievability": "internal_restricted_archive",
        "public_locator": null
      }
    },
    {
      "source_id": "SRC-DBMF-SEC-485BPOS-202606",
      "source_type": "sec_filing_metadata",
      "title": "Litman Gregory Funds Trust Form 485BPOS",
      "authority": "U.S. Securities and Exchange Commission",
      "effective_date": "2026-06-01",
      "retrieved_at": "2026-07-18",
      "filing_form": "485BPOS",
      "accession_number": "0001193125-26-196761",
      "verification_status": "verified",
      "locator": {
        "url": "https://www.sec.gov/Archives/edgar/data/1020425/000119312526196761/d44398d485bpos.htm",
        "series": "S000072813",
        "class": "C000229357"
      },
      "preservation": {
        "status": "preservation_unavailable",
        "document_sha256": null,
        "access": "unavailable",
        "retrievability": "unavailable",
        "public_locator": null
      }
    }
  ],
  "evidence": [
    {
      "evidence_id": "EVD-DBMF-RM-001",
      "source_id": "SRC-DBMF-PROSPECTUS-20250429",
      "location": {
        "section": "Principal Investment Strategies",
        "topic": "RM"
      },
      "evidence_summary": "The prospectus describes a managed-futures strategy that seeks to replicate the pre-fee performance of a representative basket of leading managed-futures hedge funds using factor analysis.",
      "supports": [
        "ECS-RM-R01"
      ],
      "status": "direct_source",
      "admission": {
        "state": "admitted",
        "protocol_version": "EAP-001-v0.1.0",
        "history": [
          {
            "state": "candidate",
            "recorded_at": "2026-07-18T11:00:00Z"
          },
          {
            "state": "identity_verified",
            "recorded_at": "2026-07-18T11:01:00Z"
          },
          {
            "state": "preserved",
            "recorded_at": "2026-07-18T11:02:00Z"
          },
          {
            "state": "extracted",
            "recorded_at": "2026-07-18T11:03:00Z"
          },
          {
            "state": "admitted",
            "recorded_at": "2026-07-18T11:04:00Z"
          }
        ]
      }
    },
    {
      "evidence_id": "EVD-DBMF-AM-001",
      "source_id": "SRC-DBMF-PROSPECTUS-20250429",
      "location": {
        "section": "Principal Investment Strategies",
        "topic": "AM"
      },
      "evidence_summary": "The prospectus explicitly identifies DBMF as an actively managed ETF.",
      "supports": [
        "ECS-AM-R01"
      ],
      "status": "direct_source",
      "admission": {
        "state": "admitted",
        "protocol_version": "EAP-001-v0.1.0",
        "history": [
          {
            "state": "candidate",
            "recorded_at": "2026-07-18T11:05:00Z"
          },
          {
            "state": "identity_verified",
            "recorded_at": "2026-07-18T11:06:00Z"
          },
          {
            "state": "preserved",
            "recorded_at": "2026-07-18T11:07:00Z"
          },
          {
            "state": "extracted",
            "recorded_at": "2026-07-18T11:08:00Z"
          },
          {
            "state": "admitted",
            "recorded_at": "2026-07-18T11:09:00Z"
          }
        ]
      }
    },
    {
      "evidence_id": "EVD-DBMF-MB-001",
      "source_id": "SRC-DBMF-PROSPECTUS-20250429",
      "location": {
        "section": "Principal Investment Strategies",
        "topic": "MB"
      },
      "evidence_summary": "The disclosed derivative universe spans equities, fixed income, currencies, and commodities.",
      "supports": [
        "ECS-MB-R02"
      ],
      "status": "direct_source",
      "admission": {
        "state": "admitted",
        "protocol_version": "EAP-001-v0.1.0",
        "history": [
          {
            "state": "candidate",
            "recorded_at": "2026-07-18T11:10:00Z"
          },
          {
            "state": "identity_verified",
            "recorded_at": "2026-07-18T11:11:00Z"
          },
          {
            "state": "preserved",
            "recorded_at": "2026-07-18T11:12:00Z"
          },
          {
            "state": "extracted",
            "recorded_at": "2026-07-18T11:13:00Z"
          },
          {
            "state": "admitted",
            "recorded_at": "2026-07-18T11:14:00Z"
          }
        ]
      }
    },
    {
      "evidence_id": "EVD-DBMF-IR-001",
      "source_id": "SRC-DBMF-PROSPECTUS-20250429",
      "location": {
        "section": "Principal Investment Strategies",
        "topic": "IR"
      },
      "evidence_summary": "The fund uses long and short derivatives, primarily futures and forward contracts, and routes commodity exposure through a wholly owned subsidiary.",
      "supports": [
        "ECS-IR-R04"
      ],
      "status": "direct_source",
      "admission": {
        "state": "admitted",
        "protocol_version": "EAP-001-v0.1.0",
        "history": [
          {
            "state": "candidate",
            "recorded_at": "2026-07-18T11:15:00Z"
          },
          {
            "state": "identity_verified",
            "recorded_at": "2026-07-18T11:16:00Z"
          },
          {
            "state": "preserved",
            "recorded_at": "2026-07-18T11:17:00Z"
          },
          {
            "state": "extracted",
            "recorded_at": "2026-07-18T11:18:00Z"
          },
          {
            "state": "admitted",
            "recorded_at": "2026-07-18T11:19:00Z"
          }
        ]
      }
    },
    {
      "evidence_id": "EVD-DBMF-IR-002",
      "source_id": "SRC-DBMF-SAI-20250429",
      "location": {